<?xml version="1.0" encoding="UTF-8"?><tt:Application xmlns:tt="http://www.example.org/sipvs" xmlns:xsi="http://www.w3.org/2001/XMLSchema-instance" xsi:schemaLocation="http://www.example.org/sipvs schema.xsd"><tt:CourseTitle>Roki</tt:CourseTitle><tt:CourseRoom>Room24</tt:CourseRoom><tt:CourseDate>2019-11-18</tt:CourseDate><tt:CourseTime>21:00:00</tt:CourseTime><tt:CourseNewbie>false</tt:CourseNewbie><tt:CourseLessons>1</tt:CourseLessons><tt:Students><tt:Student id="1"><tt:StudentFirstName>Tera</tt:StudentFirstName><tt:StudentLastName>Nova</tt:StudentLastName><tt:StudentMobile>45645645</tt:StudentMobile></tt:Student><tt:Student id="2"><tt:StudentFirstName>Digitus</tt:StudentFirstName><tt:StudentLastName>Digito</tt:StudentLastName><tt:StudentMobile>45645645</tt:StudentMobile></tt:Student></tt:Students></tt:Application>